{
  "$schema": "https://json-schema.org/draft/2020-12/schema",
  "$id": "https://saam.dev/schemas/process-plan/process-plan.schema.json",
  "title": "SAAM Machine-Resolved Process Plan",
  "description": "A versioned, machine-resolved plan: motion, tool/process state, operation dependencies, provenance, validation results, revision, and approval state. Independent of controller syntax and of any specific interface; not independent of the machine it was resolved against.",
  "type": "object",
  "additionalProperties": false,
  "required": [
    "schemaVersion",
    "revision",
    "part",
    "machine",
    "settings",
    "operations",
    "status",
    "approval"
  ],
  "properties": {
    "schemaVersion": { "type": "integer", "const": 1 },

    "revision": {
      "type": "integer",
      "minimum": 1,
      "description": "Increments on any change to part, machine, settings, or operations. An approval record is bound to one exact revision by content hash; any of those changes invalidates it."
    },

    "part": {
      "type": "object",
      "required": ["shape", "height"],
      "properties": {
        "shape": { "type": "string" },
        "width": { "type": "number" },
        "depth": { "type": "number" },
        "outerDiameter": { "type": "number", "description": "For a tapered round part (baseOuterDiameter given), this is the diameter at the top." },
        "baseOuterDiameter": { "type": "number", "description": "Diameter at the bottom, only when it differs from outerDiameter — a straight (non-tapered) round part omits this." },
        "innerDiameter": { "type": "number" },
        "height": { "type": "number" },
        "boreDiameter": { "type": "number", "description": "A centered cylindrical bore into the top face, if any — its diameter. Distinct from innerDiameter, which describes a full-through annulus (a ring/tube shape); a bore may be partial-depth. Requires boreDepth." },
        "boreDepth": { "type": "number", "description": "Depth of `boreDiameter`'s bore, measured down from the top face. Equal to height for a through-hole; less than height for a blind hole." }
      },
      "description": "The whole plan's target envelope — what the human is actually trying to build, held steady across however many operations get composed toward it. Not a per-operation field and not derived from toolpath data; an operation's own generator output happens to have the same shape (see e.g. layer-filling's generator.mjs) as a reasonable default when nothing else has been declared, but composing a second or third operation must never silently overwrite an already-declared target with that operation's own shape. Additional shape-specific fields are permitted; `shape` names which fields apply."
    },

    "machine": {
      "type": "object",
      "additionalProperties": false,
      "required": ["id", "profileRevision"],
      "properties": {
        "id": { "type": "string", "description": "Machine definition id this plan is resolved against (see machines/)." },
        "profileRevision": { "type": "string", "description": "Version or revision of the machine's instance profile used to resolve this plan." }
      },
      "description": "A process plan is meaningless without this. Re-resolving for a different machine is a new plan, not a portable one."
    },

    "settings": {
      "type": "object",
      "required": ["layerHeight", "beadWidth"],
      "properties": {
        "layerHeight": { "type": "number", "exclusiveMinimum": 0 },
        "beadWidth": { "type": "number", "exclusiveMinimum": 0 },
        "spacing": { "type": "number", "exclusiveMinimum": 0 },
        "travelHopHeight": { "type": "number", "minimum": 0, "description": "Explicit travel lift in mm above previously printed geometry; 0 for in-plane travel. Omit for legacy output. Hops are stored in paths before approval." }
      },
      "additionalProperties": true
    },

    "operations": {
      "type": "array",
      "minItems": 0,
      "description": "Zero operations is valid and expected for a target-only preview — compiled before any toolpath strategy has been chosen, so the human can confirm the target itself first. See docs/authoring/process-plan-workflow.md.",
      "items": {
        "type": "object",
        "additionalProperties": false,
        "required": ["invocationId", "operationId", "operationVersion", "parameters", "paths", "provenance"],
        "properties": {
          "invocationId": {
            "type": "string",
            "description": "Unique within this plan. Stable across revisions of the same logical operation instance so dependency and approval history can track it."
          },
          "operationId": {
            "type": "string",
            "description": "References an operation manifest's `id` (schemas/manifests/). Not a display name."
          },
          "operationVersion": {
            "type": "string",
            "description": "The operation's own version (manifest `version`) that produced this invocation's output."
          },
          "strategy": { "type": "string" },
          "parameters": {
            "type": "object",
            "description": "Must validate against the referenced operation's manifest `inputs` schema."
          },
          "at": {
            "type": "object",
            "additionalProperties": false,
            "properties": {
              "x": { "type": "number", "default": 0 },
              "y": { "type": "number", "default": 0 },
              "rotation": { "type": "number", "default": 0, "description": "Degrees counter-clockwise about Z, applied about the operation's own origin before the x/y translation." }
            },
            "description": "Where this invocation's output sits within the part. An operation generates its shape about its own origin and knows nothing about placement — that separation is the same one described in docs/architecture/operations-vs-postprocessors.md, one level up: an operation defines shape strategy, composing those shapes into a part is the plan's job. Omit for a feature that genuinely is centered (a bore, a hub, the part's own body); five identical fins differ only by their `at`, and each still carries the honest provenance of the operation that generated it. The transform is rigid-body in XY only — rotation about Z then translation — so it can never change a shape's dimensions, only where it sits. Z is untouched: layer registration is not something placement is allowed to disturb."
          },
          "dependencies": {
            "type": "array",
            "items": { "type": "string" },
            "description": "invocationIds of other operations in this plan that must be resolved first."
          },
          "toolState": {
            "type": "string",
            "enum": ["on", "off", "travel-only"],
            "default": "on"
          },
          "paths": {
            "type": "array",
            "items": {
              "type": "object",
              "additionalProperties": false,
              "required": ["family", "layer", "points", "intent"],
              "properties": {
                "family": { "type": "string" },
                "layer": { "type": "integer", "minimum": 0 },
                "intent": { "type": "string", "enum": ["print", "travel"] },
                "points": {
                  "type": "array",
                  "items": {
                    "type": "object",
                    "required": ["x", "y", "z"],
                    "properties": {
                      "x": { "type": "number" },
                      "y": { "type": "number" },
                      "z": { "type": "number" }
                    }
                  }
                }
              }
            }
          },
          "evidence": {
            "type": "string",
            "enum": ["ROBOT-CONFIRMED", "DOC-CONFIRMED", "EXPERIMENTAL", "KNOWN FAILURE", "NEEDS RETEST"]
          },
          "provenance": {
            "type": "object",
            "additionalProperties": false,
            "required": ["generatedBy", "generatedAt"],
            "properties": {
              "generatedBy": { "type": "string", "description": "operationId@operationVersion of the generator that produced this invocation's paths." },
              "generatedAt": { "type": "string", "format": "date-time" },
              "inputHash": { "type": "string", "description": "Hash of parameters + settings + machine profile, for reproducibility checks." }
            }
          }
        }
      }
    },

    "validation": {
      "type": "object",
      "properties": {
        "checkedAt": { "type": "string", "format": "date-time" },
        "passed": { "type": "boolean" },
        "results": {
          "type": "array",
          "items": {
            "type": "object",
            "properties": {
              "rule": { "type": "string" },
              "passed": { "type": "boolean" },
              "message": { "type": "string" }
            }
          }
        }
      }
    },

    "status": {
      "type": "string",
      "enum": ["draft", "preview-only", "approved", "superseded"],
      "description": "preview-only: viewable, not yet post-processed. approved: has a current, matching approval record. superseded: a later revision exists; this one is kept for history."
    },

    "approval": {
      "oneOf": [
        { "type": "null" },
        {
          "type": "object",
          "additionalProperties": false,
          "required": ["revision", "contentHash", "approvedAt", "approvedBy", "scope"],
          "properties": {
            "revision": { "type": "integer", "description": "Must equal this document's own `revision`. An approval whose revision doesn't match the current plan is void." },
            "contentHash": { "type": "string" },
            "approvedAt": { "type": "string", "format": "date-time" },
            "approvedBy": { "type": "string" },
            "scope": {
              "type": "string",
              "enum": ["geometry", "executable-export", "machine-control"],
              "description": "Geometry approval, export authorization, and direct machine-control authorization are separate permissions; this records which one was granted."
            }
          }
        }
      ],
      "description": "null until an explicit human interface action creates it. Never created by an adapter or by chat text alone."
    }
  }
}
